{
  "schemaVersion": 3,
  "suiteId": "kerf-ui-authoring-v3",
  "contracts": {
    "quality": 3,
    "conditions": 3,
    "corpus": 3,
    "request": 3,
    "response": 3,
    "evidence": 3,
    "run": 3,
    "applicationProfile": 1,
    "selectionCatalog": 1,
    "behaviorCatalog": 2,
    "diagnosticRegistry": 1,
    "doctorReport": 1,
    "analyzerReport": 1,
    "evaluatorReport": 1
  },
  "toolVersions": {
    "@kerfjs/ui": "5.0.0",
    "eslint-plugin-kerfjs": "5.0.0"
  },
  "artifactDigests": {
    "selectionCatalog": "5a465f68aa30f699155e4af84b0904512041740f1e37fe6f92a2d2df6ffe2780",
    "behaviorCatalog": "a3f77d576f8952e9a6d9bfe290ed981e8f399e0c72522cfb3423aa12ef03b543",
    "diagnosticRegistry": "4f882d5bc27249ccc3345453b6232aa0e95bbd34e5514116f6919738e91569cf",
    "qualityContract": "826cab70c896a6fd685ff5d5cc0707400d88a7632991de261dfb6237710ce5dc",
    "guidanceContext": "a8971650c58cb6b619e200a3e7cc85b1a9030f14faf9e6509c747d27847b5664"
  },
  "browserContexts": [
    {
      "id": "wide",
      "width": 1440,
      "height": 900,
      "zoom": 1,
      "colorScheme": "light",
      "reducedMotion": "no-preference"
    },
    {
      "id": "intermediate",
      "width": 900,
      "height": 768,
      "zoom": 1,
      "colorScheme": "light",
      "reducedMotion": "no-preference"
    },
    {
      "id": "narrow",
      "width": 390,
      "height": 844,
      "zoom": 1,
      "colorScheme": "light",
      "reducedMotion": "no-preference"
    },
    {
      "id": "zoom-200",
      "width": 720,
      "height": 450,
      "zoom": 2,
      "colorScheme": "light",
      "reducedMotion": "no-preference"
    }
  ],
  "visualDimensions": [
    "hierarchy",
    "rhythm",
    "density",
    "alignment",
    "scrollOwnership"
  ],
  "replayPolicy": {
    "canonicalJson": "recursive-key-sort-utf8-lf-v1",
    "doctorCache": false,
    "normalizeRecordedAt": true,
    "exactBrowserArtifactsRequireEnvironmentMatch": true
  }
}
